name,price,stars,reviews_count
Sheila Cosmetics My Brow Pencil Matita Sopracciglia con Formula Rigida Lunga Tenuta | Made in Italy (03 Light Brown/Blonde),7.68,0.86,103
"Aweskmo - Kit di trucchi per bambini, colori per trucco di carnevale, atossici, lavabili, pittura corporea, per cosplay, compleanno, Halloween, Pasqua, Natale",5.99,0.78,234
"MUSCCCM Matite Trucco, 28 Colori del trucchi halloween bambini per Trucchi Bambina/Bambini Sicuro e Non Tossico, per Truccabimbi per Bambini Carnevale, Pasqua, Halloween, Cosplay",4.58,0.76,790
"Max Factor, Colour Elixir Lip Liner, Matita Labbra Lunga Durata, Colore Intenso, 30 Mauve Moment",4.88,0.84,2550
"Essence AEB0B - Matita occhi Lunga tenuta, Verde (12 I have a green), 1 Pezzo",1.68,0.9,5036
Castle Art Supplies Set di Matite Colorate in Tinta Pastello | 48 Colori in Tonalit Delicate e Sontuose | Cofanetto di Metallo,28.68,0.94,1360
Scatola 12 matite triangolari di colore giallo,5.78,0.9,12
"Maybelline New York Matita Labbra Color Sensational Shaping Lip Liner, Automatica, Labbra Scolpite, Palest Pink (60), 0,3 g",NOT FOUND,0.84,4528
"KALOUR set di 72 matite colorate, con nucleo morbido, perfette per disegnare e per creare ombre, ideale come regalo per adulti e principianti, nonch per gli artisti.",13.93,0.92,2394
"matite arcobaleno, 4 colori in 1 matite colorate arcobaleno per forniture d'arte per bambini, matite multicolore per schizzi, regali per gli studenti (38)",11.99,NOT FOUND,NOT FOUND
"Bic Kids Matite Colorate, Evolution Ecolutions, Ottime Per La Scuola, Matite Triangolari Per Bambini, Colori Assortiti, 18 Unit, Confezione Da 2",13.61,0.92,3504
"Deborah Milano - Matita Occhi 24 Ore Automatica Waterproof, 06 Forest Green, a Lunga Durata, Alta Precisione e Ultra-pigmentata, Dona uno Sguardo Intenso e Definito, 0.5 gr",6.48,0.88,2211
"Derwent Academy Set di 24 Matite Colorate Sfumabili in Custodia di Metallo, Adatte a Colorare, Disegnare ed Illustrare",18.33,0.88,1748
"Staedtler 185-3 Matita Colorata, 12 Pezzi",3.78,0.88,199
"12 Colori Matita Labbra Set, Lucidalabbra Opaco Vellutato Facile da Usare, Impermeabile Lip Liner Naturale a Lunga Tenuta, Waterproof Matte Lip Crayon",8.29,0.74,13
"Deborah Milano - Matita Sopracciglia Formula Pura, 02 Medium Brown, Vegan, ad Alta Tollerabilit e a Lunga Tenuta, Dona un Finish Naturale e Intenso, 1.2 gr",7.45,0.82,15
"Staedtler 185-2 Matita Colorata, 12 Pezzi",9.72,0.94,155
"Koh-I-Noor S128 - Gessetto da Sarto, 2 Varianti",10.11,0.9,421
"Set di Matita Blender e Burnisher, Non Pigmentate, Matite a Base di Cera, Perfette Per Sfumare Bordi Ammorbidenti, Ideali Per Matite Colorate, Materiale Artistico",9.83,0.9,43
"Castle Art Supplies Set 120 Matite Colorate con Anima Morbida per Artisti, Professionisti e Coloristi Adulti, in Custodia Cernierata Facile Trasporto",53.27,0.94,11866
Matita colorata Ecosostenibile - STABILO GREENcolors - ARTY - Astuccio da 24 - Colori assortiti,10.19,0.9,387
"Deborah Milano - Matita Occhi 2 in 1 Kajal e Eyeliner Waterproof, 08 Light Green, a Lunga Durata, WaterProof, Tratto Ultra-pigmentato e Cremoso, Dona uno Sguardo Intenso e Definito, 1.21 gr",7.29,0.84,35
"Staedtler Noris Club  24 Matite Colorate, Cancellabili",13.73,0.86,591
Matita colorata Ecosostenibile - STABILO GREENcolors - Astuccio da 24 - Colori assortiti,10.19,0.9,1740
"KALOUR PDAS Set di 24 matite colorate a carboncino, matite a gesso pastello di alta qualit, color pelle, per disegni, ombreggiature, colorazione, crayons pastel  la craie",16.39,0.86,77
"BIC, Cristal Multicolour, Penna Sfera Colorate, Punta Larga 1.6mm, Cancelleria Scrittura Scuola, Universit e Ufficio, Confezione da 20 Unit",7.96,0.92,13710
"Matita Colorata,10 Colori Set di Matite Colorate 3 In 1,Matita Colorata, Acquerello E Pastello A Cera In Un Unico Prodotto, Con Temperino (10 Colori)",15.99,NOT FOUND,NOT FOUND
"UOPMQGB 8 matite colorate, matite arcobaleno, matite di colori assortiti, matite arcobaleno in legno nero, matite per adulti per colorare, schizzi, scuola, aula d'arte.",10.99,1.0,1
"50 Matite Colorate Professionali,Anima Morbida Per Artisti Con Colori Vivaci, Ideali Per Disegnare Schizzi, Ombreggiature, Matite Colorate Per Adulti, Artisti Principianti",16.22,0.86,29
"STAEDTLER Matite colorate Design Journey, blu, altamente pigmentate, mina morbida, legno proveniente da foreste certificate PEFC, classica forma esagonale, 6 matite colorate in scatola pieghevole,",4.98,0.84,9
"ARDFFA Matite Colorate Arcobaleno 20 Pezzi - 4 In 1 Matite Arcobaleno Per Ragazzi E Ragazze Per Dipingere, Scarabocchiare, Arte - Regalo Per Bambini Per Compleanni, Scuola, Festa Dei Bambini, Natale",8.99,NOT FOUND,NOT FOUND
"lttorjf Matite Gadget Compleanno Bambini con Gomma, Matite del fumetto con Divertente Animale Topper per Regalino, Festa Battesimo, Comunione Regalo, Scolastici (stile casuale) (30)",9.0,0.84,58
"Idena 20134-Pastelli in 12 Colori, matite Colorate in Legno FSC a Forma Triangolare ergonomica, confezionate in Astuccio di Cartone, 20134",2.21,0.88,14
"Herlitz Serie Fancy 1 Temperamatite, Ergonomico con Contenitore, Temperino Doppio, Per Matite, Pastelli Jumbo e Triangolari, Colori Variabili, Prodotto in Germania",2.36,0.86,2255
tvfly Matite Colorate Acquerellabili Multicolore,21.99,0.94,5963
KIKO Milano Everlasting Colour Precision Lip Liner 505 | Matita Automatica Contorno Labbra,7.97,0.92,7
"50 PCS Matite del fumetto con Gomma, Gadget Compleanno Bambini Matite di Legno Matite Grafite Colorate Regalino per Bambina Bambino Festa Battesimo Comunione Regalo",13.11,0.9,26
"Paper Mate Flair Penna, Punta Media da 1.1 mm, Nero, Scatola da 12",5.31,0.92,7064
"10 scatole di matite colorate, 1 gomma, mini set da colorare, 6 matite colorate per disegnare per bambini, regalo di compleanno per bambini, adatto per asilo, casa, scuola (6 pezzi)",13.13,0.78,33
"Carioca Pastelli Maxi Wax, Pastelli a Cera Lavabili con Punta Grossa per Bambini, Morbidi e Scorrevoli, in 24 Colori Assortiti e Brillanti, Facili da Temperare, 50 Pezzi",9.3,0.88,510
"Faber-Castell 201597 - Set di Pastelli Triangolari Colour Grip, 24 Pezzi, Matite Incluse, per Bambini e Adulti",NOT FOUND,0.9,349
"Seven Set Matite Colorate - Scatola da 12 pz - Confezione Pastelli Colorati - Matite Colorate Scuola, Ufficio - Pastelli MINA 4.0 - Spazio Etichetta Nome - Matite Scuola, Pastelli Scuola",6.64,0.94,7
"2 Pezzi Astuccio Arrotolabile er Matite in Tela a 36 Fori, Astuccio Rotolo con Matite Colorate, Custodia per Avvolgere la Matita di Tela,Portamatite Arrotolabile,per Studenti Pennello Pittura Artista",9.01,0.96,9
"L'Oral Paris Color Riche Le Khol Matita Occhi, 101 Midnight Black",7.98,0.86,2264
"Mengxin 6 Pcs Rossetto Matte Lunga Durata Opaco Matite Labbra Impermeabile, Lucidalabbra Waterproof Lipstick Matte Trucco per Regalo di Compleanno per Donna Ragazze (Colorato B)",8.11,0.82,1077
"Giotto 276700  Confezione di 24 matite, Multicolore",8.0,0.88,144
"Sitovely 12 colori Set di Matite per labbra Sottile, Lip Liner Pencil Set, Matita labbra cremosa e liscia, Rossetto opaco, Penna per labbra impermeabile, Natural Lip Pen Makeup",8.19,0.82,17
Partituki 30 Scatole da 6 Mini Matite Colorate. Non Tossico. Scatole Kraft Lisce. Include 1 Taccuino Singolo,19.61,0.9,120
"Set di 12 colori Kajal, set di matite colorate per eyeliner, Kajal Liner, set completo, colorato e impermeabile, per transizioni morbide per linee precise e sottili",6.55,0.74,12
"BIC Intensity, Matite Colorate per Adulti, Fusto Tondo, Colori Brillanti e Intensi, 12 Unit",5.88,0.88,112
"12 pezzi matita arcobaleno, matite colorate arcobaleno, matite colorate 7 in 1 per adulti, matite multicolori per arte, disegno, colorazione, schizzi",6.96,0.9,53
"72 matite colorate per libri da colorare per adulti,Ideali per Artisti, Adulti,colori a base di olio, in custodia da viaggio,colori assortiti",20.99,0.92,307
NOT FOUND,17.99,0.92,232
"Castle Art Supplies Set 120 Matite Colorate con Anima Morbida per Artisti, Professionisti e Coloristi Adulti, in Custodia Cernierata Facile Trasporto",53.27,0.94,11866
"Castle Arts, set di 24 matite colorate, colori perfetti per 'Seascape'. Set di matite da disegno, schizzi, matite da disegno...",17.2,0.92,6716
"H & B 122 Matite Colorate, Matite Colorate Professionali,Ideale Per Artisti Bambini Adulti Colorare,disegnare",25.4,0.94,342
Castle Art Supplies Set di 48 Matite Colorate dalle Tinte Pastello con Extra | Colori in Tonalit Delicate e Sontuose | Per Professionisti e Artisti Adulti | In Solida Custodia Cernierata da Viaggio,36.88,0.92,634
MAPED Pastelli Strong Color Peps 12 Col,7.54,0.9,7290
Caran dAche Swisscolor 30 Colori luminosi e intensi Permanenti resistenti all'acqua,26.99,0.9,33
"Deborah Milano - Matita Labbra 2 in 1 Gel Contour&Color, 03 Dusty Pink, Finish ad Alta Pigmentazione e Ultra-Scorrevole, Waterproof e a Lunga Durata, Dona Intensit e Definizione, 1.3 gr",6.55,0.82,141
"H & B 122 Matite Colorate, Matite Colorate Professionali,Ideale Per Artisti Bambini Adulti Colorare,disegnare",25.4,0.94,342
"KALOUR set di 72 matite colorate, con nucleo morbido, perfette per disegnare e per creare ombre, ideale come regalo per adulti e principianti, nonch per gli artisti.",13.93,0.92,2394
"KALOUR Matite colorate di alta qualit, set di 120 colori, con nucleo morbido e colori vivaci, ideali per disegnare schizzi, ombreggiature, matite colorate per adulti principianti",NOT FOUND,0.92,2228
"KALOUR Matite colorate professionali, set di 240 colori, con nucleo morbido e colori vivaci, ideali per disegnare schizzi, ombreggiature, matite colorate per adulti, artisti principianti",44.25,0.94,1500
"Shuttle Art 80 Matite Colorate Professionali (Numerato) Scatola Metallo, Libro da Colorare, 1 Blocco Disegno, 2 Temperini, 1 Estensore, Ideale per Artisti, Bambini, Adulti",20.48,0.92,2463
Giotto Supermina - Matite pastello 12 pezzi,NOT FOUND,0.9,88
"Rdlobu Set di 60 matite in legno HB, matite per bambini, studenti, insegnanti, ufficio, materiale scolastico, disegno, scrittura",9.49,NOT FOUND,NOT FOUND
"Matite Colorate Professionali Artistico Kit per Schizzo e Disegno, Set da 78 pezzi di matite da disegno in un astuccio con zip, Kit Disegno Set Artista per Principianti Bambini Adulti",NOT FOUND,0.92,249
"Deborah Milano - Matita Labbra BIO Formula Pura - Colore: Nude Beige n.01 - ipoallergenica, per labbra sensibili, con il 100% di ingredienti di origine naturale",7.05,0.86,18
Matita colorata acquarellabile - STABILOaquacolor - Confezione da 12 - Rosa,4.93,0.9,3
STAEDTLER Design Journey 146C C72 confezione da 72 matite colorate assortite,21.4,0.92,1316
"Fluorescenti Matite Trucco Viso e Corpo, 12 Colori Truccabimbi Viso, Trucco Neon UV Face Paint, Body Painting Colori per Pancia Gravidanza, Trucchi Fluo Party Neon Glow Fluo per Halloween Carnevale",11.98,0.82,13
Fibracolor Mat Super astuccio 24 pastelli colorati in legno esagonale punta media,10.54,0.96,7
"HIFORNY 10 matite colorate a carboncino per disegnare, colore nero e bianco, per schizzi, ombreggiature, sfumature, ritratti, ideali per principianti e artisti",11.47,0.9,331
Castle Art Supplies Set di Matite Colorate in Tinta Pastello | 48 Colori in Tonalit Delicate e Sontuose | Cofanetto di Metallo,28.68,0.94,1360
Castle Art Supplies Set di 120 Matite Colorate di Qualit Oro | Anime a Base dOlio Pi Appuntite e Resistenti alla Rottura | Per Artisti Adulti e Coloristi | In un Cofanetto di Metallo,45.89,0.92,1039
"KALOUR set di 72 matite colorate, con nucleo morbido, perfette per disegnare e per creare ombre, ideale come regalo per adulti e principianti, nonch per gli artisti.",13.93,0.92,2394
"Gadget Compleanno Bambini Partituki. Set di Pastelli a Cera Coloranti, Ognuno con 6 Pastelli. Ideale per Regalini Fine Festa Bambini e Pignatta (Pack 10)",11.07,0.92,219
"SagaSave Astuccio per matite colorato 48 Slot Penna Organizzatore con cerniera, per matite colorate e penna gel",12.52,0.86,10
"Firschoie 25 Pezzi Matite Magiche Con Gomma, per Piegare Colorate, Morbide e Flessibili, Durevole per Bambini, Regalo Festa, Premi",6.59,0.82,144
"Set matita del fumetto, Attiant 40 Pcs matita in legno con gomma matite grafite colorate con gomme, Materiale Scolastico Regalo dei Bambini, for festa di compleanno bambini party Festival",13.11,0.88,1901
"Deborah Milano - Ombretto in Stick 24 Ore Color Power Waterproof, N.10 Mat Black, al Alta Tenuta",10.54,0.86,172
Jatidne 24 Matite Bambini Regalo Feste Gadget Compleanno Bambini Matite con Gomma Simpatiche Progettazione Animale Regali Fine Festa,9.83,0.88,103
"VICHOS 48 Oleosecon Matite colorate Professionali, Pastelli Colorati con Astuccio Arrotolabile, Set Colori Soft Core Premium Colour per Bambini e AdultiGattino",15.89,1.0,1
"Ehuihuan 50 Pezzi Matite Colorate Professionali, Pastelli Colorati Acquerellabili, Set Matite da Disegno Colorate per Disegno, Schizzo, Colorazione, Art Set Fornire a Artista, Adulti e Principianti",13.93,NOT FOUND,NOT FOUND
"matite arcobaleno, 4 colori in 1 matite colorate arcobaleno per forniture d'arte per bambini, matite multicolore per schizzi, regali per gli studenti (26)",9.99,NOT FOUND,NOT FOUND
"Castle Art Supplies Set di 72 Matite Colorate con Mine dallAnima Morbida per Artisti, Professionisti e Coloristi Adulti",32.78,0.94,21723
"Castle Art Supplies Set 72 Matite Acquerellabili | Pigmenti Vibranti per Mescolanze, Disegni e Dipinti | Per Professionisti e Hobbisti Adulti",35.24,0.94,8199
NOT FOUND,7.95,0.9,12260
