name,price,stars,reviews_count
"Faber-Castell 116414 - Matite colorate tonalit pelle Black Edition, scatola di cartone da 12 pezzi, infrangibile, triangolare, tonalit pelle",11.97,0.92,333
"Carioca Pastel |43034 - Matite in Legno, Colori Pastello Assortiti, 12 Pezzi",4.54,0.88,75
BOMKEE Caso Matita Colorata con 220 Slots Portatile Handy Gel Penne Organizzatore Impermeabile Multistrato Matita Colore Titolare per Bambini e Adulti,22.11,0.92,1399
"H & B 122 Matite Colorate, Matite Colorate Professionali,Ideale Per Artisti Bambini Adulti Colorare,disegnare",25.4,0.94,342
"Castle Art Supplies Set di 72 Matite Colorate con Mine dallAnima Morbida per Artisti, Professionisti e Coloristi Adulti",32.78,0.94,21723
"Bic Kids Matite Colorate, Evolution Ecolutions, Ottime Per La Scuola, Matite Triangolari Per Bambini, Colori Assortiti, 18 Unit, Confezione Da 2",13.61,0.92,3504
"Ehuihuan 50 Pezzi Matite Colorate Professionali, Pastelli Colorati Acquerellabili, Set Matite da Disegno Colorate per Disegno, Schizzo, Colorazione, Art Set Fornire a Artista, Adulti e Principianti",13.93,NOT FOUND,NOT FOUND
"Sumnacon 160 PU pelle matita matita colore sacchetto di matita o acquerello per disegnatore professionale o amatoriale (quadrato, nero)",NOT FOUND,0.88,38
"Minecraft Astuccio scolastico  Astuccio con scomparti riempito con forniture scolastiche per bambini, bambini, ragazzi, accessori ufficiali Gamer",19.99,0.86,2568
Matita colorata triangolare - STABILO Trio thick - Confezione da 12 - Rosso,10.22,0.92,2954
"Seven Set Matite Colorate - Scatola da 24 pz - Confezione Pastelli Scuola, Ufficio - MINA 4.0 - Spazio Etichetta Nome",9.43,0.86,50
"PRIMO - Matite Colorate Bambini +3 Anni e Artisti con Mina 2.9 mm, 24 Colori a Matita Sfumabili dal Colore Pieno, Colori per Bambini Colorare, Lavoretti Creativi e Hobby, Set Matite per Cartoleria",4.42,0.86,3
"Set di matite colorate 4 in 1 arcobaleno, matite colorate, matite magiche per disegnare, colorare e fare schizzi, (30 pezzi).",6.8,0.76,215
"Carioca Baby Crayons 3in1 | Pastelloni Colorati Super Lavabili per Bambini 3 in 1, Matite Colorate e Pastelli a Cera Acquerellabili, Colori Assortiti, 10 Pezzi",14.52,0.9,718
"Pelikan Silverino, Matite Colorate con Fusto Triangolare e Impugnatura Ergonomica per Bambini, Pastelli dai Colori Intensi e Lavabili, Astuccio da 12 Colori",3.86,0.88,934
"Nicoone Astuccio da 150 scomparti per matite di grande capacit, pratico portapenne in pelle PU per matite colorate Prismacolor, penne ad acquerello, pennello cosmetico, Marrone, moda",23.98,0.74,4
Tinta Unita Hello Kitty Borsellino Rotolo con 24 Pastelli + mini astuccio Azzurro,NOT FOUND,0.9,2
"BIC Evolution Stripes, 12 matite con gomma, matite HB media, senza legno e infrangibile",2.54,0.9,1553
Caso Di Matita Di Grande Capacit - 96 Slots Oxford Matite Astuccio Matite Colorate Organizzatore Sacchetto Porta Penne Borsa by YOUSHARES (Matite non Inclusi)04,21.06,0.92,258
"Becho - Astuccio multifunzione in morbida pelle con cerniera multistrato, con scomparto per penne e matite, 184 scomparti, colore: verde",18.84,0.84,91
"PRIMO - Matite Colorate Bambini +3 Anni e Artisti Mina 3.8 mm, 24 Colori a Matita Professionali Sfumabili e dal Colore Pieno, Colori per Bambini per Colorare Lavoretti Creativi, Set Matite Cartoleria",7.68,0.86,175
"SANON Astuccio per matite colorate a 4 strati, 72 scomparti, con cerniera, Nero , moda",19.94,0.74,5
"Astuccio arrotolabile in tela con 108 scomparti, per matite colorate, per studenti artisti, studenti, matite non incluse, Nero , Classico",21.99,0.92,23
Matita bicolore - STABILO bicolor - rosso/blu - Confezione da 12,7.66,0.84,2219
"GIOTTO BEBE' - Barattolo Da 10 Matitoni, 7 mm, Colori Vivaci",NOT FOUND,0.94,1741
WINSHEA 120 Slots Oxford Matite Astuccio Scuola Borsa Matita Case Penne Holder Super Grande Capacit Matite Colorate Organizzatore,17.5,0.9,621
"AUAUY Set di 10 con 8 Matite Colorate Ciascuna, Gadget Compleanno Bambini, Piccolo Regalo per i Bambini Contro la Noia, Regalini Fine Festa Bambini, Set di Matite Colorate Bambini",7.37,0.9,55
"Harry Potter, astuccio a 3 ripiani, grande, con scomparti multicompartimenti, articoli per la scuola, cancelleria, matite colorate",17.3,0.92,10
"IGNPION, astuccio multiscomparto per 72 matite colorate, capiente, per ragazzi Black",13.11,0.88,804
"Set di cancelleria di gatto carino, 1 sacchetto per penna telescopico in tela, astuccio per matite trasformatore, 6 penne a inchiostro gel nero colorato, 30 segnalibri di gatto e 240 schede indice",15.57,0.88,267
"Castle Art Supplies Set 72 Matite Acquerellabili | Pigmenti Vibranti per Mescolanze, Disegni e Dipinti | Per Professionisti e Hobbisti Adulti",35.24,0.94,8199
NOT FOUND,17.99,0.92,232
"Castle Arts, set di 24 matite colorate, colori perfetti per 'Seascape'. Set di matite da disegno, schizzi, matite da disegno...",17.2,0.92,6716
"Castle Art Supplies Set 120 Matite Colorate con Anima Morbida per Artisti, Professionisti e Coloristi Adulti, in Custodia Cernierata Facile Trasporto",53.27,0.94,11866
"H & B 122 Matite Colorate, Matite Colorate Professionali,Ideale Per Artisti Bambini Adulti Colorare,disegnare",25.4,0.94,342
Castle Art Supplies Set di Matite Colorate in Tinta Pastello | 48 Colori in Tonalit Delicate e Sontuose | Cofanetto di Metallo,28.68,0.94,1360
"MIAOKE 168 Pezzi Set Pittura e Disegno, Scatola per Bambini, Matite Colorate, Pastelli, Pastelli a Olio, Torta Acquerello, Matite HB",16.37,0.88,485
"Carioca Pastel |43034 - Matite in Legno, Colori Pastello Assortiti, 12 Pezzi",4.54,0.88,75
BOMKEE Caso Matita Colorata con 220 Slots Portatile Handy Gel Penne Organizzatore Impermeabile Multistrato Matita Colore Titolare per Bambini e Adulti,22.11,0.92,1399
"H & B 122 Matite Colorate, Matite Colorate Professionali,Ideale Per Artisti Bambini Adulti Colorare,disegnare",25.4,0.94,342
"KALOUR set di 72 matite colorate, con nucleo morbido, perfette per disegnare e per creare ombre, ideale come regalo per adulti e principianti, nonch per gli artisti.",13.93,0.92,2394
"KALOUR Matite colorate professionali, set di 240 colori, con nucleo morbido e colori vivaci, ideali per disegnare schizzi, ombreggiature, matite colorate per adulti, artisti principianti",44.25,0.94,1500
"KALOUR Matite colorate di alta qualit, set di 120 colori, con nucleo morbido e colori vivaci, ideali per disegnare schizzi, ombreggiature, matite colorate per adulti principianti",NOT FOUND,0.92,2228
"Shuttle Art 80 Matite Colorate Professionali (Numerato) Scatola Metallo, Libro da Colorare, 1 Blocco Disegno, 2 Temperini, 1 Estensore, Ideale per Artisti, Bambini, Adulti",20.48,0.92,2463
"Minecraft Astuccio scolastico  Astuccio con scomparti riempito con forniture scolastiche per bambini, bambini, ragazzi, accessori ufficiali Gamer",19.99,0.86,2568
"Pastelli Colorati MITAMA - Pastelli Triangolari con Mina 3,3-30 Colori Brillanti - 6 Pastelli Colori Metallizzati - Facili da Temperare - con Spazio per il Nome",9.74,0.9,22
Matita colorata triangolare - STABILO Trio thick - Confezione da 12 - Rosso,10.22,0.92,2954
colozoo matite 3 in 1 | Set da 12 Colori con Pennello E Temperamatite Inclusi | Colori Atossici e Vegan per Tutti A Partire da I 3 Anni di et,13.7,0.9,1829
"Caran d'Ache Swisscolor 7630002343329 - Astuccio in cartone con 18 matite colorate impermeabili, multicolore",11.07,0.9,75
Pentel CB8 Matite Colorate 36 Pezzi,9.33,0.92,2942
"Staedtler 185-23 Matita Colorata, 12 Pezzi",3.78,0.86,115
"Seven Set Matite Colorate - Scatola da 24 pz - Confezione Pastelli Scuola, Ufficio - MINA 4.0 - Spazio Etichetta Nome",9.43,0.86,50
"CARIOCA Baby Crayons 3in1, Pastelloni Colorati Super Lavabili per Bambini 3 in 1, Matite Colorate e Pastelli a Cera Acquerellabili, Colori Assortiti, 6 Pezzi",10.98,0.9,718
"KALOUR set di 72 matite colorate, con nucleo morbido, perfette per disegnare e per creare ombre, ideale come regalo per adulti e principianti, nonch per gli artisti.",13.93,0.92,2394
Castle Art Supplies Set di 48 Matite Colorate dalle Tinte Pastello con Extra | Colori in Tonalit Delicate e Sontuose | Per Professionisti e Artisti Adulti | In Solida Custodia Cernierata da Viaggio,36.88,0.92,634
Castle Art Supplies Set di 120 Matite Colorate di Qualit Oro | Anime a Base dOlio Pi Appuntite e Resistenti alla Rottura | Per Artisti Adulti e Coloristi | In un Cofanetto di Metallo,45.89,0.92,1039
Pool Over - Tintauni 040700.03 Set Pastelli,15.16,0.94,400
"Pelikan Silverino, Matite Colorate con Fusto Triangolare e Impugnatura Ergonomica per Bambini, Pastelli dai Colori Intensi e Lavabili, Astuccio da 12 Colori",3.86,0.88,934
Matita bicolore - STABILO bicolor - rosso/blu - Confezione da 12,7.66,0.84,2219
"Faber-Castell Polychromos - 6 matite colorate, colore: nero",12.82,0.96,131
"GIOTTO BEBE' - Barattolo Da 10 Matitoni, 7 mm, Colori Vivaci",NOT FOUND,0.94,1741
"Set di matite colorate 4 in 1 arcobaleno, matite colorate, matite magiche per disegnare, colorare e fare schizzi, (30 pezzi).",6.8,0.76,215
"Paper Mate Non-Stop matita portamine, 0,7mm, HB n. 2, colori fluo assortiti, confezione da 12",8.41,0.86,3158
"PRIMO - Matite Colorate Bambini +3 Anni e Artisti Mina 3.8 mm, 24 Colori a Matita Professionali Sfumabili e dal Colore Pieno, Colori per Bambini per Colorare Lavoretti Creativi, Set Matite Cartoleria",7.68,0.86,175
"Becho - Astuccio multifunzione in morbida pelle con cerniera multistrato, con scomparto per penne e matite, 184 scomparti, colore: verde",18.84,0.84,91
WINSHEA 120 Slots Oxford Matite Astuccio Scuola Borsa Matita Case Penne Holder Super Grande Capacit Matite Colorate Organizzatore,17.5,0.9,621
"Matite colorate Colortime, rosso, mina: 3 mm, L: 17 cm, base, 12pz",NOT FOUND,0.96,79
"AMGOMH Astuccio Matite 72 Slot Ampia Capacit Porta Penne Tasca Custodia Organizzatore Borsa Cancelleria per Teenager, Studenti e Artisti",14.75,0.9,5264
Matita colorata Multi-Funzione - STABILO woody 3 in 1 - Astuccio da 6 - Colori assortiti,NOT FOUND,0.92,19613
"VICHOS 48 Oleosecon Matite colorate Professionali, Pastelli Colorati con Astuccio Arrotolabile, Set Colori Soft Core Premium Colour per Bambini e AdultiGattino",15.89,1.0,1
"Castle Art Supplies Set di 72 Matite Colorate con Mine dallAnima Morbida per Artisti, Professionisti e Coloristi Adulti",32.78,0.94,21723
"Ehuihuan 50 Pezzi Matite Colorate Professionali, Pastelli Colorati Acquerellabili, Set Matite da Disegno Colorate per Disegno, Schizzo, Colorazione, Art Set Fornire a Artista, Adulti e Principianti",13.93,NOT FOUND,NOT FOUND
"Bic Kids Matite Colorate, Evolution Ecolutions, Ottime Per La Scuola, Matite Triangolari Per Bambini, Colori Assortiti, 18 Unit, Confezione Da 2",13.61,0.92,3504
"Astuccio arrotolabile in tela con 108 scomparti, per matite colorate, per studenti artisti, studenti, matite non incluse, Nero , Classico",21.99,0.92,23
"SANON Astuccio per matite colorate a 4 strati, 72 scomparti, con cerniera, Nero , moda",19.94,0.74,5
"BIC Kids Evolution - Matite colorate cancellabili, confezione da 24",10.86,0.92,260
"AUAUY Set di 10 con 8 Matite Colorate Ciascuna, Gadget Compleanno Bambini, Piccolo Regalo per i Bambini Contro la Noia, Regalini Fine Festa Bambini, Set di Matite Colorate Bambini",7.37,0.9,55
"BIC Evolution Stripes, 12 matite con gomma, matite HB media, senza legno e infrangibile",2.54,0.9,1553
"IGNPION, astuccio multiscomparto per 72 matite colorate, capiente, per ragazzi Black",13.11,0.88,804
"FEPITO 62 Stck Matite pieghevoli, 30 Matite colorate flessibili e pieghevoli con 32 gomme carine Riempitivi per sacchetti per feste di compleanno per bambini",8.11,0.82,1748
"Matita Colorate Metalliche, Matite colorate per adulti e bambini,Adatto ai principianti nella pittura12 Colori",7.99,0.88,110
"Pool Over - Tintauni 040700.02 Pastelli Tinta Unita da 24 Mina, 4 mm",9.43,0.94,786
"Anyfirst 37 pcs Unicorno Regalo Per Ragazza, Cancelleria per Unicorno Includere Astuccio, Penne Colorate y Matite, Astuccio Unicorno Bambina di 6 7 8 9 10 11 Anni (Rose)",16.99,0.9,552
AYVANBER Astuccio per matite colorate 220 slot Portapenne in gel Borsa organizer impermeabile Borsa per pittura per artisti Astuccio portaoggetti per pennarelli ad acquerello (Verde),20.79,0.94,152
Ricarica per astuccio 18 + 18 + 2,13.75,0.92,56
"Faber-Castell 116612 - Matite colorate cancellabili con punta in gomma, 12 pezzi in scatola di cartone, 1 pz.",5.76,0.92,2453
"EDATOFLY 72 slots Astuccio Matite, Ampia Capacit Borsa per Cancelleria Porta Penne Tasca Custodia Organizzatore Borsa Cancelleria per Teenager, Studenti e Artisti (Oceano Blu)",14.75,0.9,950
"32 Pezzi Matite Gadget Compleanno Bambini, Matite Animali Colorate Regalo, Matite Gadget Compleanno Pensierini Per Bambini Dopo Regalini Fine Festa Regalini Fine Festa Compleanno",9.42,1.0,1
"OFFCUP Set Cancelleria Unicorno, 32Pcs Cancelleria per Unicorno, Unicorno per Regalo Bambina, Astuccio con Motivo Unicorno, Penne Colorate, Matite, Quaderni, Adesivi, Bambina Regalo (Unicorno)",11.97,0.86,54
"DERAYEE 24 Pezzi Matite con Gomma in Legno,Matite Colorate Gadget Regalini Fine Festa Compleanno per Bambini,Premi Scolastici",8.19,0.92,12
"Eberhard Faber 514806 - Matite colorate esagonali Colori, in 6 colori, in scatola di cartone, per dipingere, illustrare e disegnare",1.59,0.82,43
"AUAUY 12PZ Matita Senza Inchiostro Colorate, Eterna Matita per Scrivere Infinita, Matita Infinita, Matita Eterna con 12 Colori Pennino di Ricambio, per Bambini Adulti Home Office Scolastico",7.0,0.84,1972
"BIC 4 Colori, Penna Multicolore con Matita Grafite, Penna a Sfera a Scatto con 3 Inchiostri (Nero, Blu, Rosso) e 1 Matita Meccanica HB, Scuola Cancelleria Ufficio",3.89,0.94,9385
EDATOFLY 72 Slot Matite Astuccio Multifunzione Grande Astuccio Borsa Matite per Ragazzi e Ragazze,13.11,0.9,2452
"sin4sey - Set di 10 pacchettini di matitine colorate, per bambini, pensierino, per matrimonio, ristorante, in confezione color marrone",9.99,0.9,773
"SagaSave Astuccio per matite colorato 48 Slot Penna Organizzatore con cerniera, per matite colorate e penna gel",12.52,0.86,10
"matite arcobaleno, 4 colori in 1 matite colorate arcobaleno per forniture d'arte per bambini, matite multicolore per schizzi, regali per gli studenti (26)",9.99,NOT FOUND,NOT FOUND
NOT FOUND,17.99,0.92,232
"Castle Arts, set di 24 matite colorate, colori perfetti per 'Seascape'. Set di matite da disegno, schizzi, matite da disegno...",17.2,0.92,6716
"Castle Art Supplies Set 120 Matite Colorate con Anima Morbida per Artisti, Professionisti e Coloristi Adulti, in Custodia Cernierata Facile Trasporto",53.27,0.94,11866
"H & B 122 Matite Colorate, Matite Colorate Professionali,Ideale Per Artisti Bambini Adulti Colorare,disegnare",25.4,0.94,342
"KALOUR Set di 180 matite colorate per adulti e artisti,ricco pigmento a base di, a base di cera ideale per colorare disegni schizzi sfumature colori vivaci in astuccio di latta",32.78,0.94,1265
"sin4sey - Set di 10 pacchettini di matitine colorate, per bambini, pensierino, per matrimonio, ristorante, in confezione color marrone",9.99,0.9,773
"DERAYEE 24 Pezzi Matite con Gomma in Legno,Matite Colorate Gadget Regalini Fine Festa Compleanno per Bambini,Premi Scolastici",8.19,0.92,12
12 Colori Lip Liner Matita Set Alto Pigmentato Impermeabile Naturale Velluto Lip Makeup Matite Morbide Matite di Lunga Durata Opaca Smooth Ultra Fine Lip Liners,10.56,0.84,34
"H & B 122 Matite Colorate, Matite Colorate Professionali,Ideale Per Artisti Bambini Adulti Colorare,disegnare",25.4,0.94,342
"KALOUR set di 72 matite colorate, con nucleo morbido, perfette per disegnare e per creare ombre, ideale come regalo per adulti e principianti, nonch per gli artisti.",13.93,0.92,2394
"KALOUR Matite colorate di alta qualit, set di 120 colori, con nucleo morbido e colori vivaci, ideali per disegnare schizzi, ombreggiature, matite colorate per adulti principianti",NOT FOUND,0.92,2228
"KALOUR Matite colorate professionali, set di 240 colori, con nucleo morbido e colori vivaci, ideali per disegnare schizzi, ombreggiature, matite colorate per adulti, artisti principianti",44.25,0.94,1500
"Shuttle Art 80 Matite Colorate Professionali (Numerato) Scatola Metallo, Libro da Colorare, 1 Blocco Disegno, 2 Temperini, 1 Estensore, Ideale per Artisti, Bambini, Adulti",20.48,0.92,2463
"AUAUY 12PZ Matita Senza Inchiostro Colorate, Eterna Matita per Scrivere Infinita, Matita Infinita, Matita Eterna con 12 Colori Pennino di Ricambio, per Bambini Adulti Home Office Scolastico",7.0,0.84,1972
Matita colorata Multi-Funzione - STABILO woody 3 in 1 - Confezione da 5 - Oro,9.97,0.92,1008
"OFFCUP Set Di Cancelleria per Unicorno, Cancelleria per Regalo Bambina, Regalo Di Compleanno per Bambini, Include Astuccio, Matita, Matita Colorata, Pastello, Gomma, Temperamatite e Taccuino",10.65,0.84,30
Awinker 24 Matite con Gomma Colorate Regalino Fine Festa Bambini Compleanno Regalo Premi Scolastici,7.37,0.86,113
"Vicloon Matita di colore, 20 mini matite alla cera da colorare, idee regalo amici (20 pezzi 11 colori)",7.04,0.82,235
"GIOTTO Be-b - Barattolo da 12 Pastelloni a Cera Colorati, 12 Colori Assortiti",NOT FOUND,0.88,2472
"L'Oral Paris Color Riche Matita Labbra, 630 Cafe De Flore",4.42,0.84,1532
"APLI - 18060, Matite jumbo fluo, colori assortiti, confezione da 6 pezzi",5.58,0.8,245
"PIQIUQIU Matite per piegare, 30 pezzi Matite per piegare colorate, Matite flessibili per piegare, Matite per piegare, Matita per piegare magica per bambini",6.55,0.74,168
"VICHOS 48 Oleosecon Matite colorate Professionali, Pastelli Colorati con Astuccio Arrotolabile, Set Colori Soft Core Premium Colour per Bambini e AdultiGattino",15.89,1.0,1
"KALOUR set di 72 matite colorate, con nucleo morbido, perfette per disegnare e per creare ombre, ideale come regalo per adulti e principianti, nonch per gli artisti.",13.93,0.92,2394
"matite arcobaleno, 4 colori in 1 matite colorate arcobaleno per forniture d'arte per bambini, matite multicolore per schizzi, regali per gli studenti (38)",11.99,NOT FOUND,NOT FOUND
"Ainiv Colorate Matita Senza Inchiostro, 12Pz Matita Eterna con Gomma, Matita Infinita con 12 Pennini Sostituibili a Colori Extra, per Scrivere Infinita per Studenti Pittore Artista Principianto",9.01,0.8,560
"Pool Over - Tintauni 040700.01 Pastelli Tinta Unita da 18 Mina, 4 mm",8.54,0.94,684
"12 pcs Eyeliner colorati, Matite per trucco Eyeliner waterproof, matita per occhi colorati ad alta pigmentazione antimacchia, regalo da donna per spettacolo di festival",7.37,0.74,46
"Astuccio arrotolabile in tela nera da 12 a 72 scomparti, portapenne in stoffa per matite colorate, penne e pennelli, idea regalo per studenti/adulti",9.83,0.9,100
"Faber-Castell 112429 - Matita colorata 2001, FSC 100%, Rosso(Rosso Scarlatto)",1.15,0.9,950
"JOPHEK 40 x Matite in Legno del fumetto con Gomma, Divertente Animale Bambini Regalo, Colorate Regalini per Festa Battesimo, Premi Scolastici",8.99,0.8,105
"12 Colori Kajal Set zebunt matite Kajal impermeabili per transizioni morbide, Eye Pencil Liner Eye Make-up by ""Linble""",8.44,0.78,99
"Pelikan Matita Bicolore Rossa Blu, 4 mm, Impugnatura Ergonomica Triangolare, Matite Colorate Ideali per Scuola, Maestri, Insegnanti e Professori, 2 Pezzi",3.71,0.92,4406
"2 Pezzi Astuccio Arrotolabile er Matite in Tela a 36 Fori, Astuccio Rotolo con Matite Colorate, Custodia per Avvolgere la Matita di Tela,Portamatite Arrotolabile,per Studenti Pennello Pittura Artista",9.01,0.96,9
Scatola 12 matite triangolari di colore giallo,5.78,0.9,12
50 Matite in legno naturale grafite HB (50 pezzi) con gommino colore naturale,7.79,0.9,95
"BIC 4 Colori, Penna Multicolore con Matita Grafite, Penna a Sfera a Scatto con 3 Inchiostri (Nero, Blu, Rosso) e 1 Matita Meccanica HB, Scuola Cancelleria Ufficio",3.89,0.94,9385
Astuccio Arrotolabile in Tela. Astuccio Scuola per Matite Colorate / Pastelli Tinta Unita o Astuccio Portapenne. Utilizzo anche di Porta Pennelli Pittura o da Trucco. Rotolo Lavabile 48 Fori.Edo,7.61,0.9,122
"Ehuihuan 50 Pezzi Matite Colorate Professionali, Pastelli Colorati Acquerellabili, Set Matite da Disegno Colorate per Disegno, Schizzo, Colorazione, Art Set Fornire a Artista, Adulti e Principianti",13.93,NOT FOUND,NOT FOUND
"KALOUR PDAS Set di 24 matite colorate a carboncino, matite a gesso pastello di alta qualit, color pelle, per disegni, ombreggiature, colorazione, crayons pastel  la craie",16.39,0.86,77
"Matita Colorata,10 Colori Set di Matite Colorate 3 In 1,Matita Colorata, Acquerello E Pastello A Cera In Un Unico Prodotto, Con Temperino (10 Colori)",15.99,NOT FOUND,NOT FOUND
"UOPMQGB 8 matite colorate, matite arcobaleno, matite di colori assortiti, matite arcobaleno in legno nero, matite per adulti per colorare, schizzi, scuola, aula d'arte.",10.99,1.0,1
"URAQT Truccabimbi, 12 Body Painting Colori, Face Painting Bambini Pittura Corpo Sicuro e Non Tossico, Halloween Matite Trucco per Carnevale, Pasqua, Cosplay, Make Up, Pancia Gravidanza",8.19,0.9,518
Maped Pastelli Black Monster X24 Colori,7.86,0.92,1288
"ICEPAPA, 20 Pastelli colorati con 20 trottola bambini, ideali come regalini fine festa bambini e gadget festa compleanno bambini",6.55,0.82,107
"2 Pezzi Custodia per Avvolgere, Matita di Tela, 36 Fori per Matite Colorate Astuccio a Rotolo Astuccio Arrotolabile in Tela per Schizzi, Disegni, Scrittura, per Studenti Pennello Pittura Artista",10.99,0.94,41
Scatola 12 matite triangolari di colore ciano,5.93,0.88,14
"Staedtler 185-3 Matita Colorata, 12 Pezzi",3.78,0.88,199
"Spiderman Matite Colorate, Colori assortiti, Matite Colorate e da Disegno, Gadget Compleanno Bambini Set di 12 Matite Colorate, Regalini Fine Festa Bambini, Regalo Scolastico e Pignatta",7.99,0.8,60
SES-Creative 14416 - Gioco My First: Matite Colorate,NOT FOUND,0.82,1292
"NYX Professional Makeup Matita Labbra Matte, No Transfer, Non Scololorisce e Non Sbava, A Lunga Tenuta, Line Loud, 03 Goal Crusher",7.0,0.86,2608
KIKO Milano Creamy Colour Comfort Lip Liner 23 | Matita Labbra A Lunga Tenuta,7.08,0.86,2434
"Faber-Castell 110801 - Matite colorate Jumbo Grip, per quaderni e lavagne, colore: Bianco",1.76,0.92,1857
"AOOWU Fluorescenti Matite Trucco per Viso e Corpo, 6 Colori Lavabile UV Fluorescente Colorato Neon Kit, Pittura Corpo Sicuro e Non Tossico per Feste di Compleanno, Cosplay, Halloween e Natale",6.55,0.8,543
Matita Burro Interno Occhi Kajal Morbido Facile Da Sfumare Matita Illuminante Occhi Lunga Tenuta Matita Occhi Burro 17 Cm,4.84,0.82,469
"Max Factor Matita Occhi Kohl Pencil, 090 Natural Glaze, 1 Unit (Confezione da 1)",5.16,0.86,10259
KIKO Milano Colour Kajal 15 | Matita Khl Per L'Interno Dell'Occhio,6.19,0.86,1674
"Impala - Matita Occhi Cremosa Waterproof | Colore 303 Celeste | Texture Densa e Cremosa Facile da Applicare | Colore Brillante, Durevole e Resistente all'Acqua",7.52,0.8,1552
"BIC Matite Grafite a Scatto, Matic Fun, Matite HB da disegno con Gomma, Confezione da 12, Cancelleria Scuola e Ufficio",4.35,0.94,665
"Rimmel London ScandalEyes Exaggerate Eye Definer, Matita Occhi Automatica Waterproof a Lunga Durata dal Colore Intenso e Tratto Ultra Preciso, 002 Chocolate Brown - 210 g",6.55,0.88,5438
"Pelikan, Matite Grafite, Silverino, 3 Pezzi, Legno, Forma Triangolare Ergonomica, Antiscivolo, Impugnatura Matita Bambini, Prodotto in Germania",2.22,0.92,165
"Pastelli Mitama Laccato Tondo Fluo, mina 3.3, in Pet Box 12 pz.",NOT FOUND,0.86,6
"BIC Evolution Triangle, Matite HB2 Con Fusto Triangolare, Mina Resistente ed Antirottura, Prodotte Senza Legno, 12 Unit",1.75,0.9,3813
"Rimmel London Lasting Finish Matita Labbra, Lunga Durata e Colore Intenso, 705 Cappuccino, 1.2 g",4.42,0.88,8221
"MUSCCCM Matite Trucco, 28 Colori del trucchi halloween bambini per Trucchi Bambina/Bambini Sicuro e Non Tossico, per Truccabimbi per Bambini Carnevale, Pasqua, Halloween, Cosplay",4.58,0.76,790
Castle Art Supplies Set di Matite Colorate in Tinta Pastello | 48 Colori in Tonalit Delicate e Sontuose | Cofanetto di Metallo,28.68,0.94,1360
NOT FOUND,17.99,0.92,232
"Castle Arts, set di 24 matite colorate, colori perfetti per 'Seascape'. Set di matite da disegno, schizzi, matite da disegno...",17.2,0.92,6716
"Castle Art Supplies Set 120 Matite Colorate con Anima Morbida per Artisti, Professionisti e Coloristi Adulti, in Custodia Cernierata Facile Trasporto",53.27,0.94,11866
"VICHOS 48 Oleosecon Matite colorate Professionali, Pastelli Colorati con Astuccio Arrotolabile, Set Colori Soft Core Premium Colour per Bambini e AdultiGattino",15.89,1.0,1
"H & B 122 Matite Colorate, Matite Colorate Professionali,Ideale Per Artisti Bambini Adulti Colorare,disegnare",25.4,0.94,342
"BIC Matite Grafite a Scatto, Matic Fun, Matite HB da disegno con Gomma, Confezione da 12, Cancelleria Scuola e Ufficio",4.35,0.94,665
"Wet n Wild, Ultimate Brow Retractable Pencil, Matita per Sopracciglia Retraibile con Punta Triangolare e Ultra Precisa, Colore Pigmentato che Definisce il Look delle Sopracciglia, Medium Brown",4.42,0.86,8579
"BIC Evolution Triangle, Matite HB2 Con Fusto Triangolare, Mina Resistente ed Antirottura, Prodotte Senza Legno, 12 Unit",1.75,0.9,3813
"H & B 122 Matite Colorate, Matite Colorate Professionali,Ideale Per Artisti Bambini Adulti Colorare,disegnare",25.4,0.94,342
"KALOUR Set di 180 matite colorate per adulti e artisti,ricco pigmento a base di, a base di cera ideale per colorare disegni schizzi sfumature colori vivaci in astuccio di latta",32.78,0.94,1265
"KALOUR set di 72 matite colorate, con nucleo morbido, perfette per disegnare e per creare ombre, ideale come regalo per adulti e principianti, nonch per gli artisti.",13.93,0.92,2394
"KALOUR Matite colorate di alta qualit, set di 120 colori, con nucleo morbido e colori vivaci, ideali per disegnare schizzi, ombreggiature, matite colorate per adulti principianti",NOT FOUND,0.92,2228
"KALOUR Matite colorate professionali, set di 240 colori, con nucleo morbido e colori vivaci, ideali per disegnare schizzi, ombreggiature, matite colorate per adulti, artisti principianti",44.25,0.94,1500
"Rimmel London Lasting Finish Matita Labbra, Lunga Durata e Colore Intenso, 705 Cappuccino, 1.2 g",4.42,0.88,8221
