name,price,stars,reviews_count
"Amazon Basics - Matite colorate in confezione di latta da 72 pezzi, colori assortiti",16.04,0.9,703
"Castle Art Supplies Set di 72 Matite Colorate con Mine dallAnima Morbida per Artisti, Professionisti e Coloristi Adulti",32.78,0.94,21723
"Castle Art Supplies Set 120 Matite Colorate con Anima Morbida per Artisti, Professionisti e Coloristi Adulti, in Custodia Cernierata Facile Trasporto",53.27,0.94,11866
"Castle Arts, set di 24 matite colorate, colori perfetti per 'Seascape'. Set di matite da disegno, schizzi, matite da disegno...",17.2,0.92,6716
"Jovi 73424 Matite Colorate Woodless, 24 Pezzi, Colori Assortiti (734/24), Taglia Unica",NOT FOUND,0.88,1378
BIC Tropicolors pastello colorato,2.92,0.86,958
Matita colorata - STABILO color - Astuccio da 24 - Colori assortiti,7.08,0.88,7620
"H & B 122 Matite Colorate, Matite Colorate Professionali,Ideale Per Artisti Bambini Adulti Colorare,disegnare",25.4,0.94,342
"KALOUR set di 72 matite colorate, con nucleo morbido, perfette per disegnare e per creare ombre, ideale come regalo per adulti e principianti, nonch per gli artisti.",13.93,0.92,2394
"KALOUR Matite colorate professionali, set di 240 colori, con nucleo morbido e colori vivaci, ideali per disegnare schizzi, ombreggiature, matite colorate per adulti, artisti principianti",44.25,0.94,1500
"Shuttle Art 80 Matite Colorate Professionali (Numerato) Scatola Metallo, Libro da Colorare, 1 Blocco Disegno, 2 Temperini, 1 Estensore, Ideale per Artisti, Bambini, Adulti",20.48,0.92,2463
"KALOUR Matite colorate di alta qualit, set di 120 colori, con nucleo morbido e colori vivaci, ideali per disegnare schizzi, ombreggiature, matite colorate per adulti principianti",NOT FOUND,0.92,2228
"Faber-Castell 120124 - Set di matite colorate Castle, 24 pezzi, esagonali, infrangibili, per bambini e adulti",6.19,0.88,1564
"CARIOCA TITA, Matite Colorate, Set di Matite in Resina Esagonali, Pastelli per Bambini e Adulti, Ideali per Disegnare e Colorare, Scrittura Morbida, Colori Assortiti, 18 Pezzi",3.26,0.9,383
"Staedtler Matite colorate senza legno, multicolore, 12 Pezzi",2.66,0.92,7063
"Carioca Valigetta TITA | Matite Colorate e da Disegno, Scatola Portatile di Matite in Resina Esagonali con Mina Super Resistente alla Caduta, Colori Assortiti, 120 Pezzi",NOT FOUND,0.92,1331
Zenacolor 72 Matite Colorate (Numerato) con Scatola in Metallo 72 Colori Unici per Disegnare e Libri da Colorare - Facile Accesso con 3 Vassoi - Ideale per Artisti,NOT FOUND,0.92,9726
"Giotto Stilnovo Astuccio Da 24 Matite A Pastello Colorate, 3.3Mm, Multicolore, 24 Unit (Confezione da 1)",8.85,0.92,18658
NOT FOUND,21.4,0.9,1829
"Set di 72 Matite Colorate, Set Matite da Disegno con Borsa Nera Con Cerniera Portatile per Adulti e Artisti che Fanno Schizzi, Ombreggiature",19.66,0.94,1594
"TOPSEAS Matite Colorate Set,Set da 50 Pezzi Pastelli Colorati,Ideali per Sfumare e Stratificare,Art Supplies per libri da colorare per adulti o per il materiale scolastico dei bambini",12.89,0.9,932
"VICHOS 48 Oleosecon Matite colorate Professionali, Pastelli Colorati con Astuccio Arrotolabile, Set Colori Soft Core Premium Colour per Bambini e AdultiCostellazione",15.89,1.0,1
"KALOUR set di 72 matite colorate, con nucleo morbido, perfette per disegnare e per creare ombre, ideale come regalo per adulti e principianti, nonch per gli artisti.",13.93,0.92,2394
"H & B 122 Matite Colorate, Matite Colorate Professionali,Ideale Per Artisti Bambini Adulti Colorare,disegnare",25.4,0.94,342
Castle Art Supplies Set di 120 Matite Colorate di Qualit Oro | Anime a Base dOlio Pi Appuntite e Resistenti alla Rottura | Per Artisti Adulti e Coloristi | In un Cofanetto di Metallo,45.89,0.92,1039
"JOYBOY Matite colorate professionali, 72 matite colorate acquerellabili, con gomma, 2 prolunghe di matita, temperino e astuccio in tela pieghevole, ideale per bambini, adulti",15.89,0.9,197
"72 Matite Colorate, Soft Core di Qualit, Colori Intensamente Pigmentati, Matite Colorate Professionali Art Supplies per Artisti Professionisti e Coloristi Adulti",13.93,0.94,78
"HIFORNY Set di 75 matite colorate per adulti, 72 colori con extra, nucleo morbido per artisti, colori vivaci, matite da disegno, forniture artistiche per adulti, principianti e bambini",12.44,0.9,518
"STAEDTLER set da 12 matite colorate Noris Colour, tonalit differenti e mine resistenti in WOPEX, pi matita Noris HB e gomma Mars Plastic, 61 SET6",3.08,0.92,4834
"Amazon Basics - Matite colorate in confezione di latta da 72 pezzi, colori assortiti",16.04,0.9,703
"Lyuvie 100 Matite Colorate,Set Matite Colorate Professionali con Astuccio Nero Portatile e Libro da Colorare,Matite Colorate Bambini per Schizzi, Disegni e Ombreggiature",17.01,0.9,170
"Castle Art Supplies Set 72 Matite | Mine Colorate con Anima Morbida per Artisti, Professionisti e Coloristi Adulti | In Resistente Custodia Cernierata Facile Trasporto",24.58,0.94,9767
"Efimeso 100 Matite Colorate, Matite Colorate Professionali con Custodia con Cerniera nera,Matite Colorate per Adulti,Bambini, Artisti,Disegni, Schizzi e Colori",19.66,0.92,437
"TWIDDLERS - 180 Matite Colorate (30 Confezioni da 6) - Cilindro rotondo di facile presa (8,7 cm di lunghezza) - Ideale per Borse Party, Feste di Compleanno per Bambini e Aule Scolastiche",13.93,0.92,144
"KALOUR set di 72 matite colorate, con nucleo morbido, perfette per disegnare e per creare ombre, ideale come regalo per adulti e principianti, nonch per gli artisti.",13.93,0.92,2394
"Zenacolor - 160 Matite Colorate Professionali, con Scatola - Pastelli Colorati Set di 160 Colori Unici - Disegno, Schizzo, Colorazione - Per Adulti o Bambini",NOT FOUND,0.94,7005
"Amazon Aware Certificazione FSC Matite colorate, pre-temperate, Confezione da 12",2.77,0.9,638
120 Matite Colorate Acquerellabili Professionali per Adulti e Bambini con Nucleo Colorato Di Alta Qualit con Colori Vivaci per Creare Bellissimi Effetti,22.41,0.94,2384
Castle Art Supplies Set di 48 Matite Colorate dalle Tinte Pastello con Extra | Colori in Tonalit Delicate e Sontuose | Per Professionisti e Artisti Adulti | In Solida Custodia Cernierata da Viaggio,36.88,0.92,634
"VICHOS 48 Oleosecon Matite colorate Professionali, Pastelli Colorati con Astuccio Arrotolabile, Set Colori Soft Core Premium Colour per Bambini e AdultiGattino",15.89,1.0,1
"Bic Kids Matite Colorate, Evolution Ecolutions, Ottime Per La Scuola, Matite Triangolari Per Bambini, Colori Assortiti, 18 Unit, Confezione Da 2",13.61,0.92,3504
"Ehuihuan 50 Pezzi Matite Colorate Professionali, Pastelli Colorati Acquerellabili, Set Matite da Disegno Colorate per Disegno, Schizzo, Colorazione, Art Set Fornire a Artista, Adulti e Principianti",13.93,NOT FOUND,NOT FOUND
Faber-Castell 111260 Set Pastelli,17.95,0.94,15360
"Bic Kids Matite Colorate, Colori Per Bambini A Casa E A Scuola, Multicolore, 24 Unit (Confezione da 1)",7.95,0.9,12260
"Ugmic matite colorate per adulti, colori professionali per la miscelazione di pittura e schizzi, in legno di cera morbide, perfette per studenti e bambini",17.99,0.92,232
"Zenacolor - 72 Matite Colorate Professionali, con Custodia - Pastelli Colorati Set di 72 Colori Unici - Disegno, Schizzo, Colorazione - Per Adulti o Bambini",NOT FOUND,0.92,1916
Matita colorata triangolare - STABILO Trio thick - Astuccio da 24 + temperino - Colori assortiti,NOT FOUND,0.94,11734
"Svalor Set di 20 matite colorate con 6 matite colorate, 120 mini matite colorate colorate colorate in scatola di cartone, matite colorate per bambini, disegno artistico, schizzi e colorazione",13.93,0.86,27
"JOYBOY Matite Colorate,50 Set di Matite Colorate Professionali da Disegno,Con 2 Estensori per matita e 1 gomma,per Schizzi per Artisti Professionisti e Principianti",12.89,0.9,174
"Faber-Castell 205068 - Set di matite colorate metallizzate e pastello, 20 pezzi, infrangibili, per bambini e adulti",6.37,0.94,55
"STAEDTLER matite colorate Noris Colour, confezione da 24 colori con tonalit differenti e mine resistenti in WOPEX, 185 CD24",6.81,0.94,144
"Forhome Matite colorate arcobaleno 12 colori, matite colorate Jumbo per bambini, matite colorate, set di matite di legno per schizzi, disegni, colorazioni",11.99,0.9,13
"Bic Kids Matite Colorate, Evolution Ecolutions, Ottime Per La Scuola, Matite Triangolari Per Bambini, Colori Assortiti, 18 Unit, Confezione Da 2",13.61,0.92,3504
"PRIMO - Matite Colorate Bambini +3 Anni con Mina 2.9 mm, 216 Pezzi in 12 Colori a Matita Sfumabili dal Colore Pieno, Colori per Bambini Colorare, Lavoretti Creativi e Hobby, Set Matite per Cartoleria",30.04,0.9,393
"Castle Art Supplies Set di 120 Matite Colorate per Artisti, Professionisti e Coloristi Adulti | Cofanetto di Presentazione in Metallo",36.06,0.94,18883
"Shuttle Art 80 Matite Colorate Professionali (Numerato) Scatola Metallo, Libro da Colorare, 1 Blocco Disegno, 2 Temperini, 1 Estensore, Ideale per Artisti, Bambini, Adulti",20.48,0.92,2463
"GIOTTO Turbo Color - Astuccio da 36 Pennarelli a Punta Fine, 2.8mm, Colori Intensi",NOT FOUND,0.94,14685
"Zenacolor 120 Matite Colorate (Numerate) Facili da Riporre - Scatola in Metallo di Colori a Matita Professionali per Adulti - Ideali per Colorare, Mandala, Disegnare, Astuccio Cancelleria",NOT FOUND,0.92,9032
"TongFu Set 72 Matite Colorate, Colori Matite da Disegno Colorate Oleose con Anima Morbida per Adulti, Bambini, Matite Colorate Professionali con Borsa Portatile per Dipingere, Disegnare, Colorare",16.69,0.92,128
"Faber-Castell 116424 - Matite colorate Blackwood, Black Edition, astuccio da 24 pezzi",12.45,0.92,5576
"Eberhard Faber 514906 - Matite colorate corte Colori, forma esagonale, in 6 colori, in astuccio di cartone, per dipingere, illustrare e disegnare",1.06,0.82,140
"TVGO Set da 72 Matite Colorate Acquerellabili da Disegno, Comodo astuccio con zip per raggruppare e proteggere le tue matite colorateIdeali per la Scuola, per Adulti e Bambini",26.99,0.94,4107
"Pelikan Silverino, Matite Colorate con Fusto Triangolare e Impugnatura Ergonomica per Bambini, Pastelli dai Colori Intensi e Lavabili, Astuccio da 24 Colori",9.07,0.9,8358
Partituki 25 Scatole da 6 Mini Matite Colorate. Non Tossico. Scatole Lisce in Modo da Poterle Personalizzare a Proprio Piacimento,15.57,0.94,1156
"Faber-Castell 201583 - Matite colorate metallizzate, confezione da 10",3.36,0.9,2788
"matite arcobaleno, 4 colori in 1 matite colorate arcobaleno per forniture d'arte per bambini, matite multicolore per schizzi, regali per gli studenti (26)",9.99,NOT FOUND,NOT FOUND
NOT FOUND,17.99,0.92,232
"Castle Art Supplies Set 120 Matite Colorate con Anima Morbida per Artisti, Professionisti e Coloristi Adulti, in Custodia Cernierata Facile Trasporto",53.27,0.94,11866
"Castle Arts, set di 24 matite colorate, colori perfetti per 'Seascape'. Set di matite da disegno, schizzi, matite da disegno...",17.2,0.92,6716
"VICHOS 48 Oleosecon Matite colorate Professionali, Pastelli Colorati con Astuccio Arrotolabile, Set Colori Soft Core Premium Colour per Bambini e AdultiCostellazione",15.89,1.0,1
"H & B 122 Matite Colorate, Matite Colorate Professionali,Ideale Per Artisti Bambini Adulti Colorare,disegnare",25.4,0.94,342
"GIOTTO Stilnovo & Turbo Color - Box Da 50 Matite A Pastello E Pennarelli A Punta Fine + 40 Pennarelli, 2.8-3.3 mm, Colori Assortiti",23.77,0.96,2948
"Faber-Castell 110336 - Set di pastelli Classic Colour, 41 pezzi, incluso temperino e matita, per bambini e adulti",9.74,0.9,450
Staedtler matite colorate,10.64,0.9,863
"H & B 122 Matite Colorate, Matite Colorate Professionali,Ideale Per Artisti Bambini Adulti Colorare,disegnare",25.4,0.94,342
"KALOUR set di 72 matite colorate, con nucleo morbido, perfette per disegnare e per creare ombre, ideale come regalo per adulti e principianti, nonch per gli artisti.",13.93,0.92,2394
"KALOUR Set di 180 matite colorate per adulti e artisti,ricco pigmento a base di, a base di cera ideale per colorare disegni schizzi sfumature colori vivaci in astuccio di latta",32.78,0.94,1265
"KALOUR Matite colorate di alta qualit, set di 120 colori, con nucleo morbido e colori vivaci, ideali per disegnare schizzi, ombreggiature, matite colorate per adulti principianti",NOT FOUND,0.92,2228
Zenacolor 72 Matite Colorate (Numerato) con Scatola in Metallo 72 Colori Unici per Disegnare e Libri da Colorare - Facile Accesso con 3 Vassoi - Ideale per Artisti,NOT FOUND,0.92,9726
"CARIOCA TITA, Matite Colorate, Set di Matite in Resina Esagonali, Pastelli per Bambini e Adulti, Ideali per Disegnare e Colorare, Scrittura Morbida, Colori Assortiti, 12 Pezzi",4.75,0.9,537
"Faber-Castell 201583 - Matite colorate metallizzate, confezione da 10",3.36,0.9,2788
"Fzyisw 24 Pezzi Set Matite Colorate 12 Matite Colorate Arcobaleno e 12 Gomme Arcobaleno, Matite Arcobaleno per Bambini, Matita Multicolore, Matita Arcobaleno, Matite Colorate Bambini per Disegno",8.19,0.82,19
"KALOUR Matite colorate professionali, set di 240 colori, con nucleo morbido e colori vivaci, ideali per disegnare schizzi, ombreggiature, matite colorate per adulti, artisti principianti",44.25,0.94,1500
"SG istruzione CD 1285 - 730 Caran d' Ache Swisscolor - Matita (confezione da 30), multicolore",29.66,0.94,848
"Faber-Castell 112412 Matita Colorata, 12 Pezzi",10.29,0.92,8727
"Faber-Castell 112435 - Matite colorate Colour Grip 2001, 36 astuccio in metallo",25.53,0.92,2324
GIOTTO Colors 3.0 Astuccio di 12 matite colorate,5.45,0.88,410
"Professionali Colorate Matita Set e kit per disegnare,120 Matite Colorate in astuccio con zip per raggruppare e proteggere le tue matite colorate-120 Colori Unici per Disegnare",29.99,0.92,745
"KALOUR set di 72 matite colorate, con nucleo morbido, perfette per disegnare e per creare ombre, ideale come regalo per adulti e principianti, nonch per gli artisti.",13.93,0.92,2394
"matite arcobaleno, 4 colori in 1 matite colorate arcobaleno per forniture d'arte per bambini, matite multicolore per schizzi, regali per gli studenti (38)",11.99,NOT FOUND,NOT FOUND
Castle Art Supplies Set di 120 Matite Colorate di Qualit Oro | Anime a Base dOlio Pi Appuntite e Resistenti alla Rottura | Per Artisti Adulti e Coloristi | In un Cofanetto di Metallo,45.89,0.92,1039
"Set di 25 scatoline con 6 matite colorate ciascuna, Piccolo regalo per i bambini contro la noia, Regalino di compleanno, Festa per bambini, Set di matite colorate",19.95,0.9,206
"SEVEN Astuccio Scuola 3 Zip, Multicolore, Fluo Stamp, Portapenne Triplo Scomparto Completo Di Penne, Matite e Colori, Accessori Zaino Scuola, Elementari e Medie, Bambino",29.15,0.94,24
Castle Art Supplies Set di 120 Matite Acquerellabili | Pigmenti Vibranti | Disegna e Dipingi allo Stesso Tempo | Per Artisti Adulti e Professionisti | Cofanetto di Metallo,45.07,0.94,1271
Tinta Unita Skyline Astuccio Maxi 110 Colori,62.9,0.92,14
"136 Matite Colorate Professionali,Shuttle Art SoftCore Set Con Grafico Nomi Colori, Ideale Per Artisti Bambini Adulti",22.12,0.9,9187
"QUER Matite Colorate per Adulti e Bambini, 72 Colori da Disegno Oleose con Kit Borsa Portatile, Professionali per Artista e Principianti",21.99,0.94,447
"Giotto Stilnovo Maxi, Matite Colorate Spesse, Barattolo in Bio Plastica, Formato Triangolare, Mina da 4,3mm, Colori Assortiti, 48 Pezzi",21.79,0.94,34
"WGOT Matite da disegno, 72 matite da schizzo e matite colorate, per colorare e disegnare, ideali per artisti, adulti e bambini",20.08,0.94,1604
"STAEDTLER 175 M72, Matite colorate esagonali in scatola di metallo, Colori Assortiti, 72 Pezzi",18.45,0.92,3261
Giotto Stilnovo 516500 Set Matite Colorate 84 Assortiti,23.26,0.88,595
"migliori kit da disegno,72 matite Colorate in astuccio portapenne grande capacit- Pastelli Professionali Adulti e Bambini",20.48,0.92,5733
"Castle Art Supplies Set di 72 Matite Colorate con Mine dallAnima Morbida per Artisti, Professionisti e Coloristi Adulti",32.78,0.94,21723
"Seven Astuccio Scuola 3 Zip, Nero Fucsia, Iridescent, Portapenne Triplo Scomparto Accessoriato Con Penne, Matite e Colori, Accessori Scuola, Accessori Zaino, Scuola & Tempo libero, Bambina Ragazza",26.58,0.92,625
Castle Art Supplies Set di Matite Colorate in Tinta Pastello | 48 Colori in Tonalit Delicate e Sontuose | Cofanetto di Metallo,28.68,0.94,1360
"12 Pezzi Matite Arcobaleno, Matite colorate arcobaleno 7 Colori, Matita Multicolore, Matite Arcobaleno in Legno Nero, Rainbow Pencil per Disegni Artistici Colorazione Schizzi 7 in 1",9.99,NOT FOUND,NOT FOUND
"72 matite colorate per libri da colorare per adulti,Ideali per Artisti, Adulti,colori a base di olio, in custodia da viaggio,colori assortiti",20.99,0.92,307
"Castle Art Supplies Set 72 Matite | Mine Colorate con Anima Morbida per Artisti, Professionisti e Coloristi Adulti | In Resistente Custodia Cernierata Facile Trasporto",24.58,0.94,9767
"KALOUR Pro Matite Colorate, Set di 520 Colori, Nucleo Morbido per Artisti con Colori Vibranti, Ideali per Disegnare, Schizzare, Ombreggiare, Matite Colorate per Adulti, Artisti, Principianti.",111.47,0.96,152
"WGOT Matite Colorate Professionali da Disegno, 96 Matite Acquerellabili e Matite di Disegno Artistico, Creativa Colori Art Set Fornire a Artista, Adulti e Principianti",28.99,0.94,1103
"Zenacolor 72 Matite acquerellabili Pennello e Astuccio per Disegno in Metallo Scatola di Matite Colorate - Solubili, Unici e Vari, colori per adulti e bambini",NOT FOUND,0.92,11314
"ZZONEART Matite Colorate Professionali, Set da 96 pezzi di matite da disegno e per schizzi in un astuccio con zip, Kit Arte per Schizzo e Disegno con per Principianti Bambini Adulti",25.99,0.94,1930
"Pinturale Arts Set Matite Colorate Professionali |18 Colori A Matita | Base di Olio per Colori Intensi e Cremosi | Per Artisti e Illustratori | Elegante Astuccio | Set Pastelli, Colori Per Mandala",6.55,0.92,107
"Matite Colorate Acquerellabili, Set da 72 Pezzi Pastelli Colorati per Sfumare e Stratificare, Ideali per Libri da Colorare per Adulti o per il Materiale Scolastico dei Bambini",24.99,0.92,896
"WGOT Matite Colorate Professionali per Adulti e Bambini, Set da 72, Matite da Disegno Colorate Oleose con Kit Borsa Portatile per raggruppare e proteggere le tue matite colorate",19.99,0.94,423
Matita colorata triangolare - STABILO Trio thick - Astuccio da 18 - Colori assortiti,9.44,0.94,5017
"72 Matite Colorate Acquerellabili, di Disegno Artistico, Kit per schizzo e disegno,per sovrapposizioni, sfumature e ombreggiature,migliore regalo per studenti e artisti",23.99,0.94,1402
Matita colorata acquarellabile - STABILOaquacolor - ARTY - Astuccio da 36 - Colori assortiti,19.93,0.92,784
"Seven Astuccio 3 Scomparti Juventus, Best Match, Bianco e Nero, con penne, matite, colori e altro ancora",NOT FOUND,0.94,1058
"GIOTTO Supermina - Scatola Di Metallo Da 24 Matite A Pastello Colorate, 3.8 mm, Colori Intensi",19.06,0.94,1767
"Faber-Castell 120148 - Set di matite colorate Castle, 48 pezzi, esagonali, infrangibili, per bambini e adulti",13.36,0.9,2758
"rokrist 36 Set Matite da Disegno Professionali con Pennello in Scatola Matite Acquerellabili per Sfumatura, Stratificazione e Pittura ad Acquerello, Matite Acquarellabili Professionali",14.99,0.92,468
Subito disponibile Stock 30 Pezzi Piccolo Astuccio Set Colori con 6 matite pastelli Colori | 30 Gadget per Feste Party Bambini Compleanno ricordino,24.9,0.88,76
"Staedtler Matite Colorate Noris Colour, Confezione Da 24 Colori, Multicolore, 19.7 x 17.5 x 0.9 Cm",11.08,0.9,37726
"GIOTTO Supermina - Astuccio da 24 Matite a Pastello Colorate, 3.8mm",13.32,0.94,3516
"Set di matite da disegno professionali da disegno, 72 matite colorate e matite da disegno con strumenti da disegno in custodia con cerniera, ideale per artisti e adulti",NOT FOUND,0.92,340
TinyGeeks Matite Colorate Jumbo - NUOVO 2024 Matite Colorate per Bambini e Matita Arcobaleno Extra + Temperamatite + Perfetto per i giovani scolari + Raccomandato dagli Insegnanti.,5.71,0.9,372
"Bic 8297356 Kids Evolution Triangle Pastelli, 10.2 mm, Confezione da 12",4.56,0.94,10678
"Carioca TITA, Matite Colorate, Matite in Resina Esagonali, Pastelli per Bambini e Adulti, Ideali per Disegnare e Colorare, Scrittura Morbida, Colori Assortiti, 36 Pezzi",7.95,0.92,687
"Seven Set Matite Colorate - Scatola da 18 pz - Confezione Pastelli Scuola, Ufficio - MINA 4.0 - Spazio Etichetta Nome",7.79,0.86,48
Matita colorata Ergonomica - STABILO EASYcolors - per Destrimani - Astuccio da 12 - Colori assortiti,14.62,0.94,6767
"KALOUR Set di 180 matite colorate per adulti e artisti,ricco pigmento a base di, a base di cera ideale per colorare disegni schizzi sfumature colori vivaci in astuccio di latta",32.78,0.94,1265
NOT FOUND,17.99,0.92,232
"Castle Art Supplies Set 120 Matite Colorate con Anima Morbida per Artisti, Professionisti e Coloristi Adulti, in Custodia Cernierata Facile Trasporto",53.27,0.94,11866
"Castle Arts, set di 24 matite colorate, colori perfetti per 'Seascape'. Set di matite da disegno, schizzi, matite da disegno...",17.2,0.92,6716
Castle Art Supplies Set di Matite Colorate in Tinta Pastello | 48 Colori in Tonalit Delicate e Sontuose | Cofanetto di Metallo,28.68,0.94,1360
Castle Art Supplies Set di 48 Matite Colorate dalle Tinte Pastello con Extra | Colori in Tonalit Delicate e Sontuose | Per Professionisti e Artisti Adulti | In Solida Custodia Cernierata da Viaggio,36.88,0.92,634
"Castle Arts, set di 24 matite colorate Ispirato da Monet... Colorazione perfetta, schizzi, set matite da disegno",17.2,0.92,6716
"LATERN 60 Pezzi Matite per L'umore che Cambiano Colore, 19CM Matite che Cambiano Colore Attivate dal Calore Matite Termocromatiche Colorate HB con Gomma per Natale Compleanno Festa Favori (5 Colori)",13.93,0.8,2
Carioca Matite Cancellabili TITA - 24 Pz,8.67,0.92,559
"KALOUR set di 72 matite colorate, con nucleo morbido, perfette per disegnare e per creare ombre, ideale come regalo per adulti e principianti, nonch per gli artisti.",13.93,0.92,2394
"H & B 122 Matite Colorate, Matite Colorate Professionali,Ideale Per Artisti Bambini Adulti Colorare,disegnare",25.4,0.94,342
"KALOUR Matite colorate professionali, set di 240 colori, con nucleo morbido e colori vivaci, ideali per disegnare schizzi, ombreggiature, matite colorate per adulti, artisti principianti",44.25,0.94,1500
"KALOUR Matite colorate di alta qualit, set di 120 colori, con nucleo morbido e colori vivaci, ideali per disegnare schizzi, ombreggiature, matite colorate per adulti principianti",NOT FOUND,0.92,2228
"Tongfushop 120 Matite Colorate, Colori a Matita Ricche Luminose e Vibranti, Non si Spezza Facilmente, Sicure e Impermeabili, Pastelli Colorati con Temperino e Gomma per il Disegno la Colorazione",27.61,0.92,266
"Auney Regalo Bambina 4 5 6 7 8 9 10 Anni,Unicorno Set Cancelleria,Kit Cartoleria Kawaii include Astuccio Portapenne - Pennarelli Profumati - Pastelli - Penna Neutra - Colorate - Matite",NOT FOUND,0.9,222
"BIC Pink & Purple, Set Con Astuccio, 2 Penne A Sfera, 1 Penna Gel Cancellabile, 1 Pennarello Punta Fine, 2 Matite Grafite, 3 Pennarelli Indelebili, Kit Scrittura, 10 Unit, Multicolore, Idea Regalo",15.9,0.94,4538
"AYVANBER Astuccio grande 304 slots colorato in gel o 300 colori, astuccio per matite in gel per studenti, fogliame, Valigetta",25.59,0.96,146
"Carioca BI-COLOR |43031 - Matite in Legno Triangolari, Doppio Colore, 24 pezzi",6.88,0.92,357
"Pelikan Matite Colorate Cancellabili con Gommino sul Fusto, Colori Intensi e Lavabili, Legno Certificato FSC, Ideali per la Scuola, per Bambini e Adulti, Astuccio 12 Matite Colori Assortiti",4.88,0.88,1081
"GIOTTO Di Natura - Astuccio Da 24 Matite A Pastello Colorate, 3.8 mm, Colori Intensi",10.16,0.94,1464
"JAKAGO Astuccio per Matite da Disegno,Astucci di Grande Capacit per Contenere 304 Matite Colorate,Borsa per Cancelleria Impermeabile per Pittura Portatile,Ottimo Regalo per Studenti Artisti",NOT FOUND,0.92,350
"SJ Gang Astuccio Scuola 3 Zip, Rosa, Cuccioli Da SJ, Triplo Scomparto Completo Di Penne, Matite e Colori, Accessori Zaino, Scuola Elementare & Tempo libero, Bambina",26.5,0.94,418
"nsxsu Matite arcobaleno in 8 colori, matite colorate jumbo per adulti e bambini, matite multicolori per disegni artistici, colorazione, schizzi",11.47,0.92,4403
"KALOUR set di 72 matite colorate, con nucleo morbido, perfette per disegnare e per creare ombre, ideale come regalo per adulti e principianti, nonch per gli artisti.",13.93,0.92,2394
Castle Art Supplies Set di 120 Matite Colorate di Qualit Oro | Anime a Base dOlio Pi Appuntite e Resistenti alla Rottura | Per Artisti Adulti e Coloristi | In un Cofanetto di Metallo,45.89,0.92,1039
"VICHOS 48 Oleosecon Matite colorate Professionali, Pastelli Colorati con Astuccio Arrotolabile, Set Colori Soft Core Premium Colour per Bambini e AdultiGattino",15.89,1.0,1
Pentel CB9 Matite colorate acqerellabili 24 pezzi,10.45,0.94,3013
"Staedtler 185-23 Matita Colorata, 12 Pezzi",3.78,0.86,115
"JAKAGO Astuccio per matite da disegno,astucci di grande capacit per contenere 220 matite colorate,borsa per cancelleria impermeabile per pittura portatile,ottimo regalo per studenti artisti (Green)",NOT FOUND,0.92,2375
"MAPED Couleur Oops Color'Peps-24 - Astuccio triangolare ergonomico con punta in gomma, 24 matite cancellabili in resina, colorate, 832812",7.69,0.92,676
"BTSKY Custodia in pelle PU per 200 matite colorate, molto capiente, multistrato, per studenti, organizer per cancelleria (senza matite), Nero , moderno",NOT FOUND,0.92,352
Partituki 30 Scatole da 6 Mini Matite Colorate. Non Tossico. Scatole Kraft Lisce. Include 1 Taccuino Singolo,19.61,0.9,120
"Giotto Set 6 Matite Colori Classici Trucchi per Bambini (FILA, 474000)",14.03,0.86,107
"Koilox Set di 48 splendide matite colorate cancellabili a base di olio, matite colorate professionali per bambini, adulti, principianti e artisti, forniture artistiche per disegno, schizzi, libri da",9.01,0.92,220
Caso Di Matita Di Grande Capacit - 192 Slots Oxford Matite Astuccio Matite Colorate Organizzatore Sacchetto Porta Penne Borsa by YOUSHARES (Matite non Inclusi)03,27.01,0.92,195
Matita colorata acquarellabile - STABILOaquacolor - ARTY - Astuccio da 24 - Colori assortiti,10.02,0.88,579
